Reviewer Name,Review Rating,Review Text,Time Created,Business ID
Laura C T.,2,I really wanted to like it here. The location is great and the rooms are beautiful with modern decor and having a computer in each room was a nice touch....,2014-03-29 02:38:37,MnYLrGHe8ajtDWkDFa3O6A
Christine P.,4,"We loved this hotel. We would stay at an H10 property again based on our experience here at this one! While we were staying there, we used the laundry...",2024-01-09 19:13:23,VBEE8AojX0VPAjJ54Cn2ig
Patricia M.,4,"Great location off the Main Street, walking distance to old town, Lisbon.   Upon arrival, Antonio and Patricia were very welcoming and courteous.   These...",2021-11-28 20:02:24,VBEE8AojX0VPAjJ54Cn2ig
Emily C.,5,We had a phenomenal time at the H10!  All the staff were extremely helpful and friendly and the hotel itself was gorgeous.  The modern amenities were...,2017-07-21 20:39:50,VBEE8AojX0VPAjJ54Cn2ig
Dan A.,4,The NH hotel is close to the airport (less than 10 minutes by Taxi) very close to the Peninsular war monument.  Had an early flight back so wanted to be...,2019-06-25 15:00:22,qLN6VZB2fUukrEqMfUdRfA
Krys P.,4,"Quite a nice hotel, bed is a nice queen-size, not two standard put together, and very comfortable. Our room also has a mini-fridge and a bathtub instead of...",2015-05-23 18:59:22,qLN6VZB2fUukrEqMfUdRfA
Marlene A.,2,Room was tired and old. No amenities whatsoever.  Location is not recommended too far away from town. There are a lot better hotels for a lot less closer to...,2018-04-14 03:02:22,qLN6VZB2fUukrEqMfUdRfA
Elise C.,3,Checked out for the weekend and returned for business. Asked for an iron which they told me were all in use. I come back and ask again after work and they...,2018-06-19 00:30:05,tNkH0rj1ElRB6LIskSZQrA
Walter W.,1,Skip it. The ACS don't work. The showers all have little half doors that will leave you freezing the whole time. The guy that works the bar Mario I believe...,2020-02-14 13:16:05,Ik1qNmBUEKRBNcvw-3mW2w
Hafiz S.,2,"Not far from the Lisbon train station, decent location. All you will find in the area is a small amount of restaurants (nothing appealed to me) and other...",2019-02-21 22:01:47,Ik1qNmBUEKRBNcvw-3mW2w
Ruth V.,4,"The best hotels i like fr the 3 cities ive been.. Clean n nice, modern interior, perfectly blended its location too bec its a financial district n lisboa....",2014-11-15 06:46:32,Ik1qNmBUEKRBNcvw-3mW2w
Kay K.,3,"Good location, walking distance to mega mall, grocery store and restaurants but removed enough that it's quiet. Rooms are musty and extremely dry though....",2023-11-30 22:12:27,tJ4NnMzgGdZgE2iR08dFVQ
Eve B.,4,This hotel was ok. It's along a busy highway and not very walkable to much (except maybe El Corto Englais) and a cafe or two. The rooms were decent but the...,2023-01-24 08:48:44,tJ4NnMzgGdZgE2iR08dFVQ
Ulrich G.,3,"service and breakfast great, rooms great but location in the fly zone of the Lisbon airport is a little bit special. For business meetings good - for...",2017-06-23 13:36:37,tJ4NnMzgGdZgE2iR08dFVQ
Justin M.,5,"Very nice hotel. I only stayed one night, but I enjoyed my stay there. I mostly chose this hotel because it is conveniently located to Oriente train...",2022-11-12 14:16:39,gObbdCVsv0A5Fch_OdZhGg
Sophie Y.,5,Stayed in this hotel the first night in Lisbon and it's convenient located just 10 minutes walking from Oriente station. We requested a higher floor 11th...,2022-11-07 14:34:40,gObbdCVsv0A5Fch_OdZhGg
Kelly M.,3,"VIP was ok - IMO, not the 4star they advertise.  The bed was hard, no clock, the minifridge was warm and only works when you have the key in the electricity...",2019-02-21 11:59:19,gObbdCVsv0A5Fch_OdZhGg
Jen V.,5,"Clean, comfortable hotel with a good restaurant. The staff were very friendly and attentive. We were welcomed with complimentary cake and a personal note...",2024-03-02 05:05:33,hA7Hy6TujgtRZNgx1kZhDQ
Blue A.,4,"It was a pleasant stay. 

The hotel is conveniently located with various shops and restaurants just a quick walk away. Also it's near the train station if...",2022-12-12 10:34:50,hA7Hy6TujgtRZNgx1kZhDQ
Salita L.,5,"Amazing service, very friendly people. They will shower you with food and gifts. They made our stay so easy and fun. They have in house restaurant Delfina -...",2023-06-14 13:04:36,hA7Hy6TujgtRZNgx1kZhDQ
Sajani P.,3,The hotel is in a great location. Close to the metro. Walking distance to majority of the shopping areas (high need to moderate priced stores).  Near the...,2023-04-24 06:52:58,HCZj5nOjNSmSKwHydBRwnw
Misaki S.,2,"You basically pay for the location. The room is tiny, but is at least clean, however, the whole hotel has this weird dank musty wet smell. Amenities are...",2022-09-24 16:28:00,HCZj5nOjNSmSKwHydBRwnw
Angel W.,2,"This hotel is such a mixed bag. First, the good:

1. The location is perfect. You are in the middle of a great shopping district with cafes all around you....",2019-05-31 10:34:50,HCZj5nOjNSmSKwHydBRwnw
Andrew A.,4,"Nice room, love the greenery outside all the windows! Excellent, friendly front desk service. Breakfast- Meh. Terrible coffee! Restaurant good. Bar and...",2023-11-05 16:32:44,e6NP1PBZxat0wrbXTfZUqg
Shy A.,3,There is not much to complain about at this property. We stayed here for about four days while touring Lisbon. It's located about 10-15 minutes from the...,2016-02-16 04:12:09,e6NP1PBZxat0wrbXTfZUqg
Krys P.,4,"This hotel is close to the airport - 3 metro stations away, and €6-12 by Uber, depending on time of the day.  It's also just a few blocks from the Oriente...",2017-05-10 17:58:50,LH8zpDwkFasFnbMaJQOdOQ
Martine L.,3,As Ibis hotels go this one is pretty funky. Modern reception area with great little lounge and 24 hour bar/cafe which has been handy as there are no tea or...,2015-07-18 03:58:32,LH8zpDwkFasFnbMaJQOdOQ
Chynna P.,5,Stayed for one night for a layover and it was very nice! Clean and comfortable hotel with a great breakfast if you pay for it. It's about a 10 min Uber ride...,2018-12-30 15:57:25,LH8zpDwkFasFnbMaJQOdOQ
Mrs. E.,5,There are so many reasons why we love this hotel. The location is right in between two historical monuments and a hop away from the monastery.  Our room had...,2019-07-05 12:09:51,wfVzs2-GS_Ah-zQkAa8PZg
Genevieve K.,5,"This hotel was nothing short of amazing. I travel very frequently and this has to be by far the best hotel that I have stayed in, considering all of the...",2019-08-03 23:53:40,wfVzs2-GS_Ah-zQkAa8PZg
Inga W.,3,"While you have a pretty waterfront location here, it's far away from the touristy stuff and some of the rooms face the road and are very noisy. We had a...",2019-08-28 17:39:28,wfVzs2-GS_Ah-zQkAa8PZg
Terra S.,3,This review is basically about the rooftop bar not the hotel itself. We came here because we read somewhere that it was the place to be and to have a good...,2023-07-18 17:08:12,fAP3R5sOEZPbSmpm3p4XzQ
Jarvas H.,3,Had a great time in Portugal (Lisbon)!! Hotel Mundial had many great takeaways and some that were interesting to say the least. The location was perfect due...,2022-10-14 12:56:44,fAP3R5sOEZPbSmpm3p4XzQ
Richard S.,4,"The hotel is dated but has a great location. Right next to the Tram #28 and #12 .

The rooms are small but it is a city hotel. Friendly and helpful...",2022-12-10 09:36:37,fAP3R5sOEZPbSmpm3p4XzQ
Soly Z.,5,"We spent 4 nights here and had a fantastic time. The morning breakfast buffets were exquisite and full of a range of fresh fruits, pastries, desserts, and...",2022-08-30 16:54:37,ZWb3O242ppcifr7mkX0XXA
Sheri C.,2,I stayed at this hotel for three nights. The inconsistent and poor service received while here to myself and my colleagues means I won't be staying here...,2018-10-19 14:38:54,ZWb3O242ppcifr7mkX0XXA
Sarah S.,5,"Lovely hotel! 
Pleasant five star service 
The view from the UpScale bar is incredible 
The room was a really good size. The bed was huge and v comfortable....",2019-03-30 02:32:30,ZWb3O242ppcifr7mkX0XXA
Edward G.,5,"At the top of the hill in the Alfama district, Solar Do Castelo is a luxurious respite from the tourist who trod the ancient streets. Set within the outer...",2017-08-12 11:47:11,vGjfnemXAsRkzLWF8_YpLw
Ian S.,4,"Staff was great.  I liked the location, too, though not everyone would agree.  I had intentionally chosen a hotel a bit outside ""ground zero"" for tourists....",2022-11-02 08:10:50,hd5mo2R3uo3lRAcIIzgMTA
Krystin A.,1,"Our experience at the Valverde Hotel was unfortunately disappointing. During our two night stay, the air conditioning in our room was not working. When we...",2023-12-13 12:54:14,hd5mo2R3uo3lRAcIIzgMTA
Ken F.,3,"TripAdvisor's #1 hotel is Lisbon... give me a break

Yes, great location... Yes very good service... But if this is Lisbon's best, it scares me to think of...",2017-10-15 08:15:49,hd5mo2R3uo3lRAcIIzgMTA
Tulshi P.,4,"I stayed here for 2 nights and absolutely loved the hotel! The rooms were spacious, the staff was friendly and the service was amazing. Since the staff was...",2023-02-14 09:11:32,B7aWwEPmGZWdW3oed6bA6A
Wanda S.,5,"If I could give this hotel a thousand stars I would.  The hotel was beautiful, the staff were amazing and the food was excellent.  I had my birthday there...",2023-05-17 13:29:12,B7aWwEPmGZWdW3oed6bA6A
Flora H.,4,"Great little hotel with amazing service (almost too attentive, I felt like they were paying attention to my comings and goings and it was almost too much...",2018-02-03 20:57:37,B7aWwEPmGZWdW3oed6bA6A
Jennifer K.,4,"My first experience with NH hotel and I have to say I am impressed!!

A+ for everything from the check in process to the room and the location of the...",2014-08-29 17:34:27,RJ-gwHATiSQoXF0HJoPUMA
Lauren B.,5,"I did not stay at the NH hotel however, did go to the rooftop bar, pool & lounge area and was impressed. First of all, the view was amazing seeing all over...",2019-07-21 01:51:25,RJ-gwHATiSQoXF0HJoPUMA
Lucille L.,4,Such a great rooftop pool view of Portugal and balcony views from the room. Great shower heads and even a bidet to wash your ass. Excellent hospitality. My...,2015-06-03 12:55:48,RJ-gwHATiSQoXF0HJoPUMA
Ma Cielo T.,1,We decided to extend our vacation to a couple more days so we told front desk when we checked in.  Then they called us when we got to our room to ask if we...,2023-02-17 23:50:52,OBD52Csk5Lw5dgEYve2Ydw
Melissa M.,5,"I recently stayed at the BessaHotel in Libon and I was absolutely blown away! From the moment I arrived, I was welcomed with open arms by the friendly...",2023-01-17 10:33:33,OBD52Csk5Lw5dgEYve2Ydw
Aida F.,5,"Superior, excellent hotel staff, from the front desk to the bell hop.  They go out of their way to get you situated, help you find your way & make you feel...",2019-08-03 16:43:20,OBD52Csk5Lw5dgEYve2Ydw
Joanne C.,4,Nice clean room With a beautiful view of the city. Lovely rooftop bar. Customer service was very good. They only minor issue was when we asked for an...,2023-07-29 13:47:07,DLZsjWaKWdfKnYfkfwpnWQ
Golnaz S.,1,Don't get fooled with thier 5 stars rating online. The customer service is sub-par to worst. We got here around 10 pm and we made a reservation for my kid...,2022-07-14 13:34:12,DLZsjWaKWdfKnYfkfwpnWQ
Lily B.,5,"The rooms at this hotel are huge, especially by European standards. I loved the shopping neighborhood with tons of restaurants. If you want a view of the...",2018-12-28 13:40:31,DLZsjWaKWdfKnYfkfwpnWQ
Jesika Lee D.,5,We were booked into this hotel for our fourth visit to Lisbon. As with many Portuguese establishments- you win some and some you lose. This is a winner!...,2023-11-30 16:32:03,Tu6tNjeu37DxhTvIZVnFeQ
Colleen C.,5,"I absolutely adored this hotel and everything about it.

I arrived to a perfectly outfitted room with updated furnishings. Everything fresh as a flower....",2014-09-16 03:38:03,Tu6tNjeu37DxhTvIZVnFeQ
Camille C.,4,I stayed at the HF Fenix for two weeks and was absolutely pleased with my stay. Conveniently located near the metro and multiple restaurant locations. The...,2022-11-19 13:40:19,KYqeFglUCBFl6haPhoSnug
Mark B.,4,"Had a wonderful time exploring the area and discovering restaurants, shops and cultural spots.  Benfica celebrated their 38th title win while we stayed...",2023-05-30 06:02:23,KYqeFglUCBFl6haPhoSnug
Marcus K.,4,"Nice hotel just off of M Pombal.  Metro stop is right out front as are stops for the aero bus.  

Rooms are small but provide what you need.  Our rooftop...",2014-10-26 09:19:47,KYqeFglUCBFl6haPhoSnug
Wesley S.,5,"If you can make it up the multitude of stairs, the view is amazing and the food is fantastic!
The service was great and the atmosphere was very inviting....",2022-07-19 13:47:12,Q7i_PTpItlxi_sJigKw4qA
Jane F.,1,"Bad service understaffed, the entertainment was intrusive. Very disappointing. Food was ok, they don't know how to make a mojito. One waiter. Will not return",2022-08-16 14:04:01,Q7i_PTpItlxi_sJigKw4qA
Angela C.,4,"Pros:

-The Art Inn is located in a convenient location (close to the metro and train station and local attractions).
-The people that work there are...",2018-07-15 07:12:19,Q7i_PTpItlxi_sJigKw4qA
Krys P.,4,"Our red-eye trans-Atlantic flight arrived in Lisbon at 6am. We know our rooms won't be ready this early, but before we asked, the guy at the check in...",2017-11-16 21:09:45,vyBp7WBiXSOllCS_tff6FQ
Mette O.,5,"This is an excellent hotel. Modern, clean rooms with great bathrooms, good breakfast restaurant, and staff is very nice and helpful. 
Location is perfect...",2016-07-21 03:51:46,F_IBrPSZvkkwAs_eCpkuvQ
Jim S.,3,Pretty nice hotel except you cannot adjust the air conditioning. Also will not give you a refill for the espresso coffee pods in your room and want to...,2023-10-10 09:05:26,F_IBrPSZvkkwAs_eCpkuvQ
Matthew B.,4,"This place is great.  Modern, clean rooms, a great restaurant located beneath, awesome location for Lisboa nightlife, friendly staff, great wifi, free...",2014-02-02 08:53:23,F_IBrPSZvkkwAs_eCpkuvQ
Freya P.,5,"Loved this 5 star hotel, guess i really didn't know what to expect as I normally book 4 star hotels, lol  Let me tell you, not only is this boutique hotel...",2023-10-23 17:06:56,pmA7DXMxOawDkvoyyiGF3w
Mark G.,5,Wonderful hotel and spa. Reasonably priced for great value. We're attentive and helpful and spa service was nice.,2023-10-15 18:12:41,pmA7DXMxOawDkvoyyiGF3w
Brensi M.,4,"This is a small rooftop on the 4th floor of the hotel, it is nice decorated and it has a good relaxed ambiance. The staff is friendly and the drinks were...",2022-06-03 20:35:50,pmA7DXMxOawDkvoyyiGF3w
Akemi W.,5,"Great hotel right by the airport. I don't think anyone stays at these type of places unless they have a very early or late flight, and I feel like a lot of...",2019-10-30 12:42:24,vFM8jBv6Jcc5A2tiIzrlVA
Mark K.,1,"I showed up because I was running out of power with my Tesla at a Destination charger. The Tryp at the harbor was closed, but they said, please go to the...",2021-06-03 04:52:58,vFM8jBv6Jcc5A2tiIzrlVA
Travel L.,1,I have never stayed at this hotel but the horrible booking experience has prompted me to write a review. I booked a room on the hotel website for September...,2022-10-24 13:06:07,vFM8jBv6Jcc5A2tiIzrlVA
Brittany W.,5,"I visited Lisbon, Portugal, for the first time in November 2021 and stayed at Fontecruz Lisboa!

It was a WONDERFUL experience. All the staff we encountered...",2021-12-06 13:10:12,1D4-pyl1i0MhDOXqv57RIg
Wayne H.,5,"Beautiful modern property. 

The staff is multi-lingual ( for us lazy Americans). 

The check in process was easy and were quickly greeted by the bell hop....",2022-07-24 02:01:34,1D4-pyl1i0MhDOXqv57RIg
Jose R.,5,Excelent hotel to stay. Service was subperb and everyone was friendly. Rooms are spacious and well decorated. Sits on the main strip and metro as well as...,2023-02-26 08:07:32,1D4-pyl1i0MhDOXqv57RIg
Greg T.,4,"We were transiting through Lisbon and needed a hotel for the night.  My wife and I decided the Ramada by Wyndham fit the bill.
Close (15 minute taxi ride)...",2023-03-24 02:46:58,gRyLEYnGDckZYsDXl7Lirg
Ryan H.,5,What a fantastic experience for us on a tough day. We were rerouted through Lisbon and had to find a last minute room.  9Hotel Mercy really came through for...,2023-08-21 07:08:27,JopTbqOH6jVuMv-Oj6NP9Q
Larry D.,3,"Not impressed. 

Location- great location with walking access to many shops and restaurants. 

Staff- unfriendly and unhelpful

Morning breakfast- included....",2022-10-23 15:12:16,JopTbqOH6jVuMv-Oj6NP9Q
Olivia D.,1,"DO NOT book a room here. It calls itself a 4 star hotel, but I've stayed in better Holiday Inns. They WROTE down my credit card number for incidentals. They...",2023-05-29 08:41:21,JopTbqOH6jVuMv-Oj6NP9Q
Darlene S.,1,BEWARE OF THIS HOTEL!  This hotel is unsafe. Uneven floors and lack of railings. I fell shattered my arm in lobby. Management told me that I was not the...,2023-12-28 01:23:29,UtoJY2lnHIEOJOhyYrqKhw
Linda E.,2,Hipster chic over cleanliness! I smelled an odor of rotten trash as I entered and especially in the elevator. The room had so much perfumed room deodorizer...,2022-05-23 15:26:06,UtoJY2lnHIEOJOhyYrqKhw
Eric S.,5,"I'm so excited to write this review! 

My husband and I just got back from our honeymoon in Lisbon and stayed here. Manuel was the gentlemen who helped us...",2018-04-30 09:15:03,UtoJY2lnHIEOJOhyYrqKhw
Sam S.,5,A beautiful hotel located by the sea about 12km from Lisbon City centre. It's very close to the airport and we stayed here for a conference. The hotel is...,2018-06-10 15:00:46,CXGhjpsDuK0FusDit3iKQw
Reverend M.,5,"Utterly fabulous! 

This hotel is a wonderful escape with a luxurious finish.
The food is very good, as-are the facilities. 
We managed to get a premium...",2019-03-02 09:15:12,CXGhjpsDuK0FusDit3iKQw
Neluta G.,5,"Great hotel located on the river in Lisbon, love the architecture of the hotel. It is resembling a sail boat and if you look at the hotel from a distance...",2017-05-22 14:15:59,CXGhjpsDuK0FusDit3iKQw
Alberto G.,5,"I really like this hotel. 
Only 70 rooms, quite, familiar, spa, swimming pool. 
the rooms are so spacious and clean, taking care about details. 
Raining...",2014-11-30 08:00:11,MMzWj2f92xiFerwrC8StOA
Nick J.,5,"We stayed for 6 nights in a city view superior room, and loved every part of it! Principe Real was the perfect place to spend our week; it felt like a great...",2023-03-24 09:21:12,PH_8HKvVeGlZC6btE-6sWw
Bonni R.,5,This is a lovely and unpretentious boutique hotel with amazing views past the outdoor lap pool and patio area. The staff is kind and helpful and genuinely...,2022-03-25 06:27:12,PH_8HKvVeGlZC6btE-6sWw
May W.,2,"Beware of bait and switch with your room selection! 
The rooms look nothing at all as they are shown online 
Booked junior suite and was escorted to a room...",2023-04-12 20:03:52,PH_8HKvVeGlZC6btE-6sWw
Dipali G.,5,This was a great hotel with amazing people working here. We spent about 5 days in this hotel and I was so happy that we did. It is very reasonably priced...,2023-02-05 18:16:10,G6aDuRMpDJGWvFIUC6Tduw
Steve S.,4,Really glad Wifey chose this hotel in Chiado right next to the Praça de Camões. Our room looked right out over the place and we were able to enjoy a...,2023-04-20 06:40:08,QIIGuree1Qf6Z68_WcmYnw
Ali B.,5,An amazing hotel experience! The apartment I stayed in overlooked the plaza. Everything was immaculate. The breakfast was delicious. Will absolutely come...,2023-09-02 04:56:19,QIIGuree1Qf6Z68_WcmYnw
Lin L.,4,"We got lucky choosing this hotel for our stay in Lisbon.  First and foremost, the location is so good.  The hotel is located in Chiado on the edge of Bairro...",2019-11-02 14:19:16,QIIGuree1Qf6Z68_WcmYnw
Stephanie S.,5,"Primely located just a stone's throw away from the  main street, the hotel is conveniently located. Everything that a visitor would desire is within a...",2023-08-01 03:36:14,abqCfRI4heBp-IbBtHvnoA
Missy T.,5,"I stayed here for one night but I wish I was staying here for my whole trip. I booked it last minute for my 30th birthday. The front desk, Jessica, was very...",2022-08-21 02:30:34,abqCfRI4heBp-IbBtHvnoA
Suzanne B.,5,"In a sea of crappy tourist restaurants, Lisbon Wine Hotel offers high-quality, tasty cuisine. I've been here twice this week.",2022-07-28 12:19:07,abqCfRI4heBp-IbBtHvnoA
Scott H.,5,"If you're planning on doing a family trip to Lisbon, this is the hotel to stay at! This is a hotel with families in mind. 

The hotel staff are extremely...",2023-07-02 08:29:25,r0mWN0CoLImlQLqIlop63w
Zachary P.,5,"Absolutely amazing place to stay. Staff was awesome, breakfast was good and as you can expect. The staff there was great. If you have young kids this is the...",2023-05-11 12:50:20,r0mWN0CoLImlQLqIlop63w
Lina F.,5,Stay here! Families with toddlers and babies! Stay here! The staff is amazing and they have babysitting services for shifts - 9:30-11:30 and 4:30-6:30! Then...,2016-11-23 15:52:49,r0mWN0CoLImlQLqIlop63w
MJ D.,4,"A beautiful convent converted hotel, located conveniently with a short ride or pleasant walk away from tourist spots.",2017-08-06 08:23:22,S9KuIF-EioW9OgdoY9ZtHw
Thierry S.,4,"From the airport, I took a taxi and paid 10 eur
The second day, I had to go to the convention centre
At the reception, they advised to take the...",2016-11-13 08:55:30,iQ2V-XUFa6FjAGGEDEABBw
Valencia W.,4,I have nothing but an excellent review for SANA MALHOA Hotel! It was one of the greatest experiences we had during our stay. It is near the Praça de España...,2014-01-12 16:56:35,iQ2V-XUFa6FjAGGEDEABBw
TJ B.,5,This place is amazing!! The bed is so comfortable. Describing the decor and atmosphere is a bit overwhelming but it was fantastic and a truly incredible...,2021-10-14 13:26:21,gWNTfyGWNL-eIxYHQmR2rg
Ariela V.,5,"I stayed in this place in late May with my husband, staying at Casa dell'arte was an absolute dream. The house is gorgeous, the rooms are beautiful and the...",2018-07-03 23:10:58,gWNTfyGWNL-eIxYHQmR2rg
Ken L.,5,Perfect hotel to stay at! Location was okay but the hotel is stunning. Portuguese tile everywhere and art displayed throughout. There is a large living...,2019-11-14 04:02:18,gWNTfyGWNL-eIxYHQmR2rg
Richard B.,4,"Very modern, chic hotel. The breakfast is great but cold beverages are served at room temperature which is different.

The staff is polite and friendly. My...",2019-08-28 07:10:31,t9zu3GgtBVQogIYyEamWSQ
Andrew S.,5,We thoroughly enjoyed our stay. Thank you to Paulo the on-site manager who made sure our room was satisfactory for our family of four and Emmanuel the...,2023-06-22 03:25:45,w2NVajknvu8XXiGkD8gB1g
Michael U.,5,"Located near upscale shops, green spaces and a metro station Hotel Lisboa Plaza is an incredible find for under 80 Euros a night.  Family-operated with...",2021-10-21 04:23:22,w2NVajknvu8XXiGkD8gB1g
Carol K.,4,What a lovely hotel and it's located right in the middle of all there is to do in Lisbon!  I did upgrade to a suite so I had a little more space that a...,2017-06-25 18:07:12,w2NVajknvu8XXiGkD8gB1g
Aggie S.,5,We stayed here for one night because we had an overnight flight in Lisbon. This hotel is located in the Belém neighborhood so it's pretty far from the...,2019-10-18 14:31:45,zTXn6HH9lTcjyMB3d8Zp1g
John H.,5,"Realizing most higher end restaurants in Lisbon are closed on Christmas, we were delighted to find Rossio, on the 7th floor welcoming use for dinner that...",2016-12-29 15:13:24,If6go1YXAOH0Zann16KjRw
Martin B.,4,"I loved the location, close to famous Avenida da Liberdade and many Lisbon sights. The standard room was large and comfortable, no complaints here. The beds...",2017-03-28 05:41:06,If6go1YXAOH0Zann16KjRw
Michaela R.,5,"A beautiful small hotel right at the boundary of the centre and a fashionable quarter. Very rich and varied breakfasts - their lichee compote, melons, but...",2017-04-08 07:35:58,If6go1YXAOH0Zann16KjRw
Mel T.,3,"Stayed at this hotel for two nights in December. Here are some pros/cons:

Pros:
-Less than a 5 minute walk to the metro
-Mini fridge
-Plenty of sink...",2024-01-04 04:56:45,M-URexQjVHXeRxQ7csDBFA
Monica G.,3,I travel quite a lot and would rate this hotel as average.   The location is pretty good and about a 15-20 minute walk to the city center where you can find...,2019-04-10 12:35:32,M-URexQjVHXeRxQ7csDBFA
Nathan T.,4,"This is a business class hotel that is popular with tourists. Excellent service, very clean, with a standard but nice selection of items for breakfast. The...",2019-01-19 21:23:46,M-URexQjVHXeRxQ7csDBFA
Elisa R.,1,"My husband and I stayed here in March and had an awful experience. 
- the hotel advertises that they have AC but to our surprise there was no AC. We were...",2020-06-17 12:38:00,wTIfr_azEl9pd6nRGckEBw
Jeff F.,5,"Hotel is awesome, the breakfast buffet not so much...

The hotel is centrally located near the city centre and is walking distance to a lot of the major...",2019-03-19 02:43:35,wTIfr_azEl9pd6nRGckEBw
Jeong B.,3,"It nice hotel. Small. Downtown. ONE thing I don't like, bathroom all glass! With curtain! Like window!

Boyfriend watch me pee! So uncomfort. Why have this?...",2017-08-02 19:03:46,wTIfr_azEl9pd6nRGckEBw
Danny B.,5,This is really a great Holiday Inn! The staff are super friendly and helped us with some great recommendations. The selections of drinks at the hotel bar...,2023-06-22 05:57:53,jfxwV5kgiaJH17cxY5Dtwg
Joy D.,3,"Breakfast was thorough and full. There is fruit as a DF / GF option, but most of the other options are for all-inclusive diets. They do advertise laundry...",2023-03-04 00:58:31,jfxwV5kgiaJH17cxY5Dtwg
Michael O.,5,I would stay here again. It's off a quiet side street of a busy street. Concierfe and check in went smoothly and the room was really nice.,2019-07-17 23:15:30,jfxwV5kgiaJH17cxY5Dtwg
Irina K.,5,"Hotel Alegria is a wonderful hotel right off the famous Av da Liberdade.
It is next to the cute little park, in a middle of everything, walking distance...",2023-05-26 07:48:15,XaLVe_KVlnPW52fcOOKUgg
